{
  "schema_version": "1.0",
  "part": "QT_S_PART2",
  "criteria": {
    "CRIT_S_FC": {
      "band": 6,
      "comment": "Người nói trả lời liền mạch và đủ thời lượng cho Part 2, nhưng có vài chỗ ngập ngừng ở đầu câu và một lần tự sửa lại.",
      "evidence": [
        {
          "quote": "Um, I want to talk",
          "error_type": "ERR_LONG_PAUSE",
          "suggestion": "Chuẩn bị sẵn câu mở đầu để vào bài ngay, thay vì ngập ngừng ở đầu."
        },
        {
          "quote": "the food is, the food was",
          "error_type": "ERR_SELF_CORRECTION",
          "suggestion": "Xác định thì quá khứ ngay từ đầu để tránh phải sửa lại giữa câu."
        }
      ]
    },
    "CRIT_S_LR": {
      "band": 6,
      "comment": "Vốn từ đủ để kể về chuyến đi nhưng khá đơn giản và lặp lại từ 'very'; chưa dùng nhiều cụm từ ít phổ biến.",
      "evidence": [
        {
          "quote": "the sea is very beautiful",
          "error_type": "ERR_REPETITION",
          "suggestion": "Thay 'very beautiful' bằng 'stunning' hoặc 'breathtaking' để đa dạng cách diễn đạt."
        }
      ]
    },
    "CRIT_S_GRA": {
      "band": 5,
      "comment": "Có câu ghép và câu có 'because' nhưng lỗi thì động từ và hòa hợp chủ vị lặp lại nhiều lần.",
      "evidence": [
        {
          "quote": "a city I visit last year",
          "error_type": "ERR_VERB_TENSE",
          "suggestion": "Dùng quá khứ: 'a city I visited last year'."
        },
        {
          "quote": "people is friendly",
          "error_type": "ERR_SVA",
          "suggestion": "'People' là số nhiều nên dùng 'people are friendly'."
        },
        {
          "quote": "we swim every morning",
          "error_type": "ERR_VERB_TENSE",
          "suggestion": "Câu kể về quá khứ nên dùng 'we swam every morning'."
        }
      ]
    },
    "CRIT_S_P": {
      "band": 6,
      "comment": "Phát âm nhìn chung dễ hiểu, theo điểm phát âm đầu vào (accuracy 78.5, prosody 68); một vài từ chưa đúng trọng âm.",
      "evidence": [
        {
          "quote": "really delicious",
          "error_type": "ERR_WORD_STRESS",
          "suggestion": "Nhấn trọng âm vào âm tiết thứ hai: de-LI-cious."
        }
      ]
    }
  },
  "overall_band": 6.0,
  "out_of_calibration_range": false,
  "summary": "Bài nói trôi chảy ở mức khá và kể được trọn vẹn về chuyến đi. Điểm cần cải thiện nhất là dùng đúng thì quá khứ và hòa hợp chủ vị, đồng thời đa dạng từ vựng.",
  "improvements": [
    "Luyện kể chuyện trong quá khứ bằng thì quá khứ đơn",
    "Kiểm tra hòa hợp chủ vị với danh từ số nhiều như 'people'",
    "Học thêm từ đồng nghĩa với 'good' và 'beautiful' để tránh lặp từ"
  ]
}
